{
  "format": "vizir-selection-links/1",
  "document_id": "linked-services",
  "scene_sha256": "d1bc550a0a9dcfe4b8ba94447e1dd83a899407a54500af65e46a133adf0b67c6",
  "instance_key": "main",
  "groups": [
    {
      "id": "api",
      "members": [
        "status/api-card",
        "topology/node/api/shape",
        "topology/node/api/label",
        "latency/point/api"
      ]
    },
    {
      "id": "database",
      "members": [
        "status/db-card",
        "topology/node/db/shape",
        "latency/point/db"
      ]
    }
  ]
}
